{
  "product_id": "PRODUCT-CNC-ELECTRIC-GUITAR-BASELINE-V1",
  "product_name": "Baseline CNC Solid-Body Electric Guitar",
  "status": "draft",
  "construction": {
    "body_type": "solid_body",
    "neck_joint": "bolt_on",
    "scale_length_in": 25.5,
    "string_count": 6,
    "orientation": "right_handed"
  },
  "materials": {
    "body": "alder",
    "neck": "maple",
    "fingerboard": "maple"
  },
  "configuration": {
    "pickup_layout": "sss",
    "bridge_type": "standard_tremolo",
    "control_layout": "one_volume_two_tone",
    "finish_system": "baseline_shop_finish"
  },
  "provenance": {
    "source": "engineering_estimate",
    "confidence": "draft",
    "references": [],
    "note": "Neutral reference geometry for internal manufacturing-cost modeling. Not a branded model."
  },
  "notes": [
    "INTERNAL product definition for manufacturing-estimate development only.",
    "Not a customer catalog item and not a representation of any protected brand or model.",
    "Contains no cost, price, or margin fields by design."
  ]
}
